Название товара;Описание;Имя продавца;Телефон продавца;Дата публикации;Цена;Ссылка на товар
Котенок. Питомник кошек породы Мейн Кун Raksi Line;" Предлягается под резерв прекрасный, солнечный котенок Френки  Родители:  GICh Friderick SW;T of Fridericks House MCO n ; Country Gulliver's ZaLuxi El MCO fs22  1,5 месяца. Родился 28 июня.  Сможет переехать в новый дом в 3 месяца. Уже приучен к лотку и когтеточке, все прививки будут сделаны.   Очень любознательный, ласковый мальчик с прекрасными породными данными, спокойно засыпает на руках и охотно помогает по дому. Будет отличным другом и антидепрессантом.  Возможна отправка в другие регионы.  #питомник #котята #рыжий #мейнкун";кирилл;5 52144155721;2014-09-26 10:14:00.0;50000;http://www.avito.ru/sankt-peterburg/koshki/kotenok._pitomnik_koshek_porody_meyn_kun_raksi_line_386783610
Котик мейн кун;" Предлягается под резерв котик класса ;ПРЕМИУМ;   Френки  Родители:  GICh Friderick SW;T of Fridericks House MCO n ; Country Gulliver's ZaLuxi El MCO fs22  1,5 месяца. Родился 28 июня.  Сможет переехать в новый дом в 3 месяца. Уже приучен к лотку и когтеточке, все прививки будут сделаны.  Очень любознательный, ласковый мальчик с прекрасными породными данными, спокойно засыпает на руках и охотно помогает по дому. Будет отличным другом и антидепрессантом.  Возможна отправка в другие регионы.";Марина;352155541415;2014-09-15 14:35:00.0;50000;http://www.avito.ru/sankt-peterburg/koshki/kotik_meyn_kun_386848644
Котенок мейн кун; Продается красивый породный мальчик Edwin.  Родился 06 мая 2014 года. Очень активный и дружелюбный. Вырастит огромным котом. Приучен к лотку и когтеточке. Документы есть, чип по желанию.   второе фото отца, третье-мамы;Марина;352155541415;2014-09-29 14:59:00.0;45000;http://www.avito.ru/sankt-peterburg/koshki/kotenok_meyn_kun_397301659
"2-к квартира, 54 м&sup2;, 3/9 эт."; Предоставляем 2-х комнатную квартиру со всем необходимым для удобного проживания. Постоянным клиентам предоставляем скидки, командированным все необходимые документы для отчетности.;Галина;8902 91540702;2014-09-29 10:53:00.0;1200;http://www.avito.ru/norilsk/kvartiry/2-k_kvartira_54_m_39_et._413777028
"2-к квартира, 59 м&sup2;, 2/5 эт."; Собственник! Продам 2-х комнатную сталинку ул. Комсомольская 14, 2-ой этаж после капитального евро ремонта. Окна ПВХ во двор, эл. проводка медь, потолки гипсокартон, двери заменены, с/у кафель, трубы медь, сантехника новая, ванна чугунная, стены выровнены, обои под покраску. Делали ремонт для себя. Очень теплая, уютная и светлая квартира в хорошем районе. Документы готовы.;ТатьянаБорисовна;8 913 52545745;2014-09-29 12:05:00.0;2000000;http://www.avito.ru/norilsk/kvartiry/2-k_kvartira_59_m_25_et._420383379
